,title_g,description_g,manufacturer_g,price_g,id_g
703,firebox x550e gateway antivirus intrusion prevention service 1yr - watchguard -,,,494.055,http://www.google.com/base/feeds/snippets/18369279634486504985
704,22101258 adobe acrobat capture - ( v. 3.0 ) - license - 1 user 20000 pages - win - engli,adobe systems 22101258 : usually ships in 24 hours : in stock : adobe acrobat capture 3.,,268.2,http://www.google.com/base/feeds/snippets/13039474391309731778
705,qp card qp colorkit 1 color management software,qp colorkit 1 - color correction kit for digital images help your digital camera! like all cameras your digital camera has problems with color accuracy. however for digital cameras there is a solution qpcolorkit 1. it is easy to use and ...,,99.95,http://www.google.com/base/feeds/snippets/2032472776224854572
706,enfocus software pp7.0-sg-001 - pitstop pro 7.0,enfocus software pp7.0-sg-001 : enfocus software pitstop pro 7.0 - pp7.0-sg-001,,558.97,http://www.google.com/base/feeds/snippets/14235968984166622494
707,encore software 10652 - web.com site builder & hosting suite sb by web.com,encore software 10652 : encore software web.com site builder & hosting suite sb by web.com - 10652,,41.97,http://www.google.com/base/feeds/snippets/6596219200360663289
708,punch software 10603 - concepts 3d cad design,punch software 10603 : punch software concepts 3d cad design - 10603,,247.97,http://www.google.com/base/feeds/snippets/9392415130007315021
709,high impact email marketing 3.0,overview a marketing tool for small businesses. high impact email marketing provides three steps on how to grow your business from creating powerful marketing that gets you noticed. sending professional campaigns to new and existing customers to ...,,12.9,http://www.google.com/base/feeds/snippets/8301505750101645725
710,adobe audition 2.0 software pro audio digital editing environment for windows upgrade version.,adorama camera: top new features: mix an unlimited number of tracks in a flexible low-latency environment with asio support. record your parameter changes on-the-fly and edit and master youraudio with innovative tools for processing visualization ...,,122.95,http://www.google.com/base/feeds/snippets/1532472446439845707
711,punch software 17100 punch! super home suite,our bestselling premium home design software with professional yet easy-to-use features! 17100 punch software,punch software,45.99,http://www.google.com/base/feeds/snippets/8376577004489658408
712,microsoft office and windows training professional,for almost two decades learn2 has helped over 8000000 consumers including professionals from fortune 500 companies and government agencies to enhance their computer skills. let the in-depth courseware in learn2 training pro for microsoft office,,29.99,http://www.google.com/base/feeds/snippets/18396389648150219430
713,intuit quicken premier 2007 software for windows tax & finance software,quicken premier 2007 software for windows the quicken premier 2007 software for windows from intuit is a software package that is designed to help you track your personal finances. it allows you to create a budget schedule bill payments verify ...,,73.95,http://www.google.com/base/feeds/snippets/18177463782265275234
714,bryan pezzone classic americana,1. danza 2. to a wild rose 3. from uncle remus 4. an old garden 5. indian idyl 6. of br'er rabbit 7. canoeing 8. sliding on ice 9. the lake at evening 10. lanquid dance 11. pastoral dance 12. festive dance 13. down a country road 14. midsummer ...,,23.59,http://www.google.com/base/feeds/snippets/16819192068186772755
715,csdc ntx-2003-01r notetaker for os x v1.5 - aquaminds software,a third generation outline and information processor that helps you manage anything and everything in one place. notetaker 2003 is powerful new os x software for organizing your information lifestyle your digital workstyle. at its most basic level ...,csdc,59.99,http://www.google.com/base/feeds/snippets/2914315195947217599
716,exmpi555300m1200u exceed 3d 2007 - upgrade package - 1 user - cd - win,hummingbird exmpi555300m1200u : usually ships in 24 hours : in stock : exceed 3d adds the advanced graphical computing power of opengl api - the industry standard three dimensional visual interface - to exceed.,,137.35,http://www.google.com/base/feeds/snippets/13140629964435442990
717,encore marine aquarium 2.0,os9: 9.0 or higher; osx: 10.1.5 or higher g3 350 mhz or higher 48mb ram (3mb free) opengl accelerated video drivers with 8mb vram (16mb vram for larger than 1024x768) 2mb of free hard disk space cd-rom quicktime 2.5 or later,,19.99,http://www.google.com/base/feeds/snippets/4441393199380874556
719,three-to-a-page itemized invoice checks,descriptive invoice box printed on check for listing invoice numbers and notes.no carbons no mess! choose 1- or 2-part carbonless safety paper checks in your choice of blue green or yellow tint background.stub records date amount and name of ...,,104.39,http://www.google.com/base/feeds/snippets/12493670640490574677
720,encore software 10669 - hoyle backgammon - win 98 me 2000 xp,encore software 10669 : hoyle the 1 best selling game authority revives yet another classic board game. hoyle backgammon is great for players of all levels! system requirements: windows 98se/me/2000 sp4/xp (home and pro) sp1¹ pentium ii 233mhz ...,,7.69,http://www.google.com/base/feeds/snippets/11611566315397308287
721,3d home architect home v.8by encore software,3d home architect home v.8by encore software,,33.92,http://www.google.com/base/feeds/snippets/2062975649512805986
722,encore software 10118 - adventure workshop 4th-6th grade 7th ed sb cs by riverdeep,encore software 10118 : encore software adventure workshop 4th-6th grade 7th ed sb cs by riverdeep - 10118,,17.97,http://www.google.com/base/feeds/snippets/5515688203820371988
723,microsoft office outlook 2007,key features: manages time and info works with sharepoint enhanced search one-click functionality create internet calendars enhanced security ...,,109.95,http://www.google.com/base/feeds/snippets/9255722138583214734
724,making the software business case by reifer donald j. 9780201728873,master the 1 skill developers need to transform their ideas into reality: making the business case!-- packaging your ideas to demonstrate their compelling business value.-- quantifying costs and benefits: savings cost avoidance faster ...,,34.64,http://www.google.com/base/feeds/snippets/11211072591263183946
725,encore software 10731 - the print shop 22 pro publisherdeluxe sb cs by the print shop,encore software 10731 : encore software the print shop 22 pro publisherdeluxe sb cs by the print shop - 10731,,81.97,http://www.google.com/base/feeds/snippets/14520556770161082452
726,school zone interactive vocabulary puzzles 1 on track software,vocabulary puzzles 1 helps children recognize pronounce and spell words. engaging activities games and animated rewards make this electronic workbook a great way to learn! system requirements: windows®: microsoft® windows® 9,,9.45,http://www.google.com/base/feeds/snippets/18105761375553744131
727,punch software 35100 punch! professional home design suite (small box),12 powerful programs in one gives you total control over every phase of your home design project including electrical and mechanical systems! 12 integrated programs in one easy-to-use interface. professional home design suite includes 3d home design ...,punch software,62.99,http://www.google.com/base/feeds/snippets/8900923119664778651
728,software engineering with reusable components by j. sametinger 9783540626954,the book provides the reader with a clear understanding of what software reuse is where the problems are what benefits to expect the activities and different forms of software reuse. the reader is also given an overview of what sofware ...,,92.0,http://www.google.com/base/feeds/snippets/2052705990697878865
729,adobe(r) photoshop(r) cs windows full version,upgrade today to adobe photoshop cs with adobe imageready(r) cs software and be more productive than ever before. innovative features help you design faster improve image quality and manage your files for the timesaving efficiency every ...,,590.92,http://www.google.com/base/feeds/snippets/13342689240311947950
730,aspyr doom iii,minimum system requirements doom 3 runs on any imac g5 or any mac that meets the requirements below operating system: mac os x 10.3.8 or later cpu processor: powerpc g4/g5 or later cpu speed: 1.5ghz or faster memory: 512 mb or higher hard disk ...,,45.99,http://www.google.com/base/feeds/snippets/2275328841264109872
731,gods: lands of infinity - spec,,,16.99,http://www.google.com/base/feeds/snippets/18415890873747923115
732,92708 tun plus 2005 - version upgrade license - 1 additional user - win,esker software 92708 : usually ships in 24 hours : : a unique approach to host access and host access management enables unparalleled breadth of connectivity - along with multilingual support.,,66.09,http://www.google.com/base/feeds/snippets/12918318395802813699
733,poser 7 (win 2000 xp/mac 10.4 or higher ub),poser is the standard for depicting the human form in 3d. poser is used for figure design and animation by hobbyists and professional graphic artists.using poser digital artists can easily create traditional art comics education and training ...,,199.99,http://www.google.com/base/feeds/snippets/18365358438027236949
734,individual software inc small business advantage deluxe,15 essential office marketing tools and business resources you'll need to grow your business. launch e-mail campaigns design brochures write your employee handbook and more. system requirements: pentium pc or higher,,16.9,http://www.google.com/base/feeds/snippets/17033785854482020785
735,aspyr the sims complete collection,system requirements: operating system: mac os x 10.3.9 or later cpu processor: powerpc g3 or later cpu speed: 500mhz or faster memory: 256 mb or higher hard disk space: 3.5 gb free disk space video memory (vram): 4 mb or higher media required: dvd ...,,47.99,http://www.google.com/base/feeds/snippets/1936516034668822172
736,microsoft windows xp pro oem sp2 no open box returns,please note: this is just a disk. there is no box manual.. anything.,,149.99,http://www.google.com/base/feeds/snippets/16729750960777382226
737,csdc x3mac x3: reunion - virtual programming ltd. mac 10.4 or later ub,x : reunion continues to lead the way in offering players the ultimate open ended game play experience backed by an addictive storyline and intense combat/trading action. utilising the 'x reality' engine x pushes the graphical boundary to movie ...,csdc,42.6,http://www.google.com/base/feeds/snippets/18418631443367666576
738,sega of america inc rome total war gold edition,rome: total war gold edition brings together the multi award winning rome and critically acclaimed expension barbarian invasion. available in one great value offering this is the perfect opportunity for armchair generals to conquer and control the ...,,18.77,http://www.google.com/base/feeds/snippets/16769449274864717899
739,poetry fiction and drama (win/mac) (jewel case) (10172),poetry fiction and drama (win/mac) (jewel case) brand: fogware publishing mpn: 10172 variant name: poetry fiction and drama (win/mac) (jewel case),,9.59,http://www.google.com/base/feeds/snippets/9675508034468866052
740,allume checkit system performance suite,system requirements intel or ppc based mac. (techtool platinum is universal binary) mac os x 10.3.9 or newer (10.4 required for techtool platinum 4.5.1 a disk image of 4.1.1 is included for 10.3.9 compatibility) dvd drive,,84.99,http://www.google.com/base/feeds/snippets/13825743693732119715
741,quickbooks simple start 2007 intuit,key features: track sales and expenses user-friendly organized data instant reports...,,99.99,http://www.google.com/base/feeds/snippets/13631557261313424700
742,encore software 14060 - terror strike - win 2000 xp,encore software 14060 : cto: counter-terrorist ops close-quarters assault is a tense accurate simulation of close quarters combat. lead four-man teams in assaults on terrorist strongholds. rescue hostages held at gunpoint. recreate the deadly ...,,18.97,http://www.google.com/base/feeds/snippets/6628446350064818078
743,punch software 14100 punch! professional home design suite for windows,12 powerful programs in one gives you total control over every phase of your home design project including electrical and mechanical systems! punch! professional home design suite is the home design software package that lets you design all of the ...,punch software,62.99,http://www.google.com/base/feeds/snippets/9122006997888271580
744,encore software 11250 - brain food games: cranium collection 2006 - win 98 me 2000 xp,encore software 11250 : brain food games cranium collection is back and better than ever! new content new games to train your brain for maximum efficiency! system requirements: windows 2000 sp4/xp (home& pro) sp2³ pentium iii 450 mhz processor or ...,,18.97,http://www.google.com/base/feeds/snippets/13440353610523579374
745,sega of america inc sonic mega collection,loaded with hyper-speed ring collecting fun sonic mega collection plus? features sonic's early adventures that turned the blue dude with a 'tude into one of the first video game superstars. both long time fanatics and newcomers to the series,,17.55,http://www.google.com/base/feeds/snippets/18003213870869015246
746,adobe premiere pro cs3 video editing software for mac av production software,premiere pro cs3 video editing software for mac the premiere pro cs3 video editing software for mac from adobe is a professional video nle and dvd creation suite. the software includes all the great features you expect from nle software including ...,,798.95,http://www.google.com/base/feeds/snippets/6968597519129780490
747,microsoft office 2004 standard,system requirements: g3 mac os x-compatible processor or higher mac os x version 10.2.8 or later 256 mb of ram 450 mb of available hard-disk space for a recommended install of office; 630 mb for a full drag-and-drop install of office cd-rom drive,,369.99,http://www.google.com/base/feeds/snippets/17784299186975876292
748,encore software 10023 - hoyle mahjongg (win 98 me 2000 xp),encore software 10023 : hoyle mahjongg challenges your skill and strategy with the world s greatest mahjongg collection. system requirements: windows 98se/me/2000 sp4/xp sp1 pentium ii 300 mhz cpu 32mb ram (64mb for 2000 128mb for xp) 175mb free ...,,7.47,http://www.google.com/base/feeds/snippets/14640507864355837784
749,adobe cs3 after effects upgrade,system requirements powerpc® g4 or g5 or multicore intel processor mac os x v.10.4.9 1gb of ram for dv; 2gb of ram for hdv and hd 500mb of available hard-disk space plus 2gb of space for optional content (additional free space required during ...,,306.99,http://www.google.com/base/feeds/snippets/7972469902462196789
750,adobe acrobat v8.0 professional for mac upgrade,system requirements powerpc or intel core duo processor mac os x v10.4.3 256mb ram (512mb recommended) 1gb free hard-disk space 1024 x 768 display resolution dvd-rom drive,,145.99,http://www.google.com/base/feeds/snippets/3626343668255224722
751,microsoft d48-00369 word mac 10.0 eng gov't 659556873790,microsoft d48-00369 word mac 10.0 eng gov't 659556873790,,191.94,http://www.google.com/base/feeds/snippets/18403352308945312678
752,adobe photoshop lightroom,windows system requirements microsoft® windows® xp with service pack 2 intel® pentium® 4 processor 768mb of ram (1gb recommended) 1gb of available hard-disk space 1024x768 screen resolution cd-rom drive macintosh system requirements mac os x v.10.4 ...,,264.99,http://www.google.com/base/feeds/snippets/3907261301303045278
753,encore software 10941 - scooby-doo frights camera mystery sb cs by riverdeep,encore software 10941 : encore software scooby-doo frights camera mystery sb cs by riverdeep - 10941,,17.97,http://www.google.com/base/feeds/snippets/13990215962326719230
754,allume stuffit deluxe 10.0 os x 10.4 or higher,system requirements mac os 10.3 or better. mac os 10.4 tiger is required for automator and spotlight support.,,69.99,http://www.google.com/base/feeds/snippets/12825336441689158397
755,micromat techtool protege utility with 1gb firewire flash drive,system requirements ppc g3 or better capable of booting from firewire mac os x 10.4 or greater dvd-rom drive firewire port 512 megabytes ram or higher,,219.99,http://www.google.com/base/feeds/snippets/17666397403215916975
756,encore software 10593 - encore tlc clue finders math learning system 2007 - complete product - educational - 1 user - complete product - standard - pc mac,encore software 10593 : build a bevy of sharp math skills as you trek high in the himalayas with the cluefinders! they're on a quest to find missing ancient treasures and they need your sharp wits to hunt for clues. from purchasing supplies in the ...,,17.97,http://www.google.com/base/feeds/snippets/9859735236279839568
757,chessmaster 9000: feral interactive,minimum system requirements (macintosh) mac os 10.2 powerpc g3/g4 700 mhz 256 mb ram hardware accelerated 3d graphics card with 16 mb vram dvd drive 1.3 gb free hard disk space. mouse and keyboard quicktime 6 recommended system requirements ( ...,,38.99,http://www.google.com/base/feeds/snippets/15283790763832398825
758,microsoft word 2007 upgrade (pc),key features: professional content share your documents business integration better manage content...,,109.95,http://www.google.com/base/feeds/snippets/12218017436042377109
759,global marketing partners icopydvds2 ultra by digital wunders,full version dvd-rom,,79.9,http://www.google.com/base/feeds/snippets/18403568462989725383
760,computrace lojack for laptops - 1 yr subscription,refuse to be a victim of crime: fact: your laptop has a 1 in 10 chance of being lost or stolen this year. fact: according to fbi estimates the second most common crime just after identity theft is laptop theft. each year 2 million notebook ...,,45.99,http://www.google.com/base/feeds/snippets/11524039735478682676
761,instant immersion italian audio (audio book),business trip to bologna? vacation in venice? from milan to messina now you can join the conversation with instant immersion italian the dynamic audio language learning system on 8 compact discs. format: audio book,,19.95,http://www.google.com/base/feeds/snippets/18411046341072063935
762,namco museum 50th anniversary,namco is celebrating 50 years of bringing you the greatest games on the planet by releasing the biggest and best compilation of time-honored all-star arcade classics. namco museum 50th anniversary features 14 of the most treasured namco original ...,,16.95,http://www.google.com/base/feeds/snippets/13375500071540864237
763,jungle software gorilla standard 4.0 film production,power pc© g3 or intel processor 256mb ram 512mb recommended 400mb available hard disk space macintosh os x 10.2 and above monitor capable of 1024x768 screen resolution,,269.99,http://www.google.com/base/feeds/snippets/10851688356333529622
764,encore software 11253 - brain food games: cranium collection 2006 sb cs by encore,encore software 11253 : brain food games: cranium collection 2006 sb cs by encore - 11253,,17.97,http://www.google.com/base/feeds/snippets/15401280256033043239
765,instant home design 1 (jc),2 cd-roms that make designing and remodeling your home fun easy and accurate. plan your project first before spending the money. includes: instant remodeling instant interior design instant dream home and instant deck pool & hot tub. the ...,,12.9,http://www.google.com/base/feeds/snippets/5720091777255380975
766,reel deal casino quest (win 95 98 me 2000 xp),reel deal casino quest! brings the high-paced fast action of a los vegas casino right to your pc move your character through the bustling casino to explore every corner and every game. enter tournaments to achieve master status of each game and ...,,19.95,http://www.google.com/base/feeds/snippets/18398774476993389905
767,pop up oxford spanish / english dict,the oxford spanish dictionary contains over 170000 words and phrases and 240000 trans-lations and describes spanish as it is used throughout the whole spanish-speaking world. an authoritative guide to contemporary spanish language and culture in a ...,,13.95,http://www.google.com/base/feeds/snippets/18436194751131787997
768,910623-000 rumba web-to-host for as/400 - ( v. 4.2 ) - license - 1 processor - tier p60 - s,netmanage 910623-000 : usually ships in 24 hours : : rumba web-to-host lets you cost-effectively leverage important assets on your legacy host systems literally within minutes.,,29578.09,http://www.google.com/base/feeds/snippets/13660085133260357894
769,symantec 10517904 - client security v.3.1 business pack - complete product - internet security - 50 user(s) - complete product - standard - pc- free shipping,symantec 10517904 : symantec client security business packs proactively protect your business from viruses spyware and hackers. the antivirus and client firewall operate together to eliminate malicious code and block online intrusions. integrated ...,,1895.97,http://www.google.com/base/feeds/snippets/18434800306472435486
770,encore software 10991 - pc tools spyware doctor 2007 sbcs by pc tools,encore software 10991 : encore software pc tools spyware doctor 2007 sbcs by pc tools - 10991,,25.97,http://www.google.com/base/feeds/snippets/11808064350838387307
771,adobe indesign cs3 for mac upgrade from pagemaker,system requirements powerpc g4 or g5 or intel core processor mac os x v10.4.8 256mb ram (512mb recommended) 1.6gb free hard-disk space (additional space required during installation) 1024 x 768 display resolution with 16-bit video card dvd-rom drive ...,,205.99,http://www.google.com/base/feeds/snippets/16934204320953872944
772,absolute software lfl-n2-36 - computrace lojack for laptops - 3 year license (win 2000 xp),absolute software lfl-n2-36 : computrace lojack for laptops is a software-enabled recovery service that allows law enforcement to recover stolen laptops. if your laptop is stolen and isn't recovered within 30 days we will refund your purchase of ...,,85.97,http://www.google.com/base/feeds/snippets/15013560737417394943
773,sibelius sibelius 4 software - educational discount music production software,sibelius 4 - software for writing playing printing and publishing music notation for mac os x and windows - educational discount sibelius 4 from sibelius is a fully featured and complete software solution for writing playing printing and publishing ...,,249.95,http://www.google.com/base/feeds/snippets/5286999908576362211
774,corel ulead dvd moviefactory 6 software for windows authoring software,dvd moviefactory 6 software for windows the dvd moviefactory 6 software for windows from corel ulead allows you to create and burn dvd discs on your home computer. you'll be able to copy and edit dvd discs and print disc labels. dvd menu templates ...,,49.95,http://www.google.com/base/feeds/snippets/10686405526722482213
775,adobe cs3 design standard academic,system requirements powerpc g4 or g5 or intel core processor mac os x v10.4.8 java runtime environment 1.5 1gb ram 5.3gb free hard-disk space (additional space required during installation) 1024 x 768 display resolution with 16-bit video card ...,,385.99,http://www.google.com/base/feeds/snippets/7795796130761039507
776,adobe production premium cs3 software suite for mac av production software,production premium cs3 software suite for mac the production premium cs3 software suite for mac from adobe is a software bundle that is aimed at video producers and editors. the bundle includes photoshop cs3 extended illustrator cs3 flash cs3 ...,,1698.95,http://www.google.com/base/feeds/snippets/2253075076541338967
777,pxl smartscale for mac/win,one image any size.,,159.95,http://www.google.com/base/feeds/snippets/18391865764441158658
778,ringtone media studio (pc) avanquest,key features: create ringtones design screensavers...,,19.99,http://www.google.com/base/feeds/snippets/13468530879861986847
779,individual software professor teaches excel & word,professor teaches excel and word is the complete multimedia training program for the most popular microsoft applications. it covers versions for office 2003 and office xp. both core and advanced courses are included. eight separate tutorials on two ...,,19.99,http://www.google.com/base/feeds/snippets/12849123232978824729
780,apple software m9301z/b soundtrack v1.2,produce music with thousands of loops and effects! soundtrack brings the art of music composing to everyone. with minimal cost and effort you can produce custom music to your video dvd or web project. you wont need to license a song or hire a ...,apple software,199.0,http://www.google.com/base/feeds/snippets/4081985616275580076
781,intuit quickbooks pro 2007 software for windows tax & finance software,quickbooks pro 2007 software for windows the quickbooks pro 2007 software for windows from intuit is a bookkeeping application designed for small to medium-sized businesses. it allows you to print checks and pay bills. you can also use the software ...,,179.95,http://www.google.com/base/feeds/snippets/4699273716641936158
782,hallmark half-fold matte prem. blank greeting cards(20 pack) (paper),insist on hallmark premium greeting cards for truly spectacular results. easy! print customized greeting cards for any event or occasion. high-quality! heavyweight card stock coated for better color and crisper text. compatible! works with all ...,,10.99,http://www.google.com/base/feeds/snippets/18400554570218912442
783,ca antivirus 2007,ca antivirus 2007 is an award-winning antivirus solution that provides complete protection detection and eleimnation of thousands of computer viruses worms and trogan horse programs. system requirements: 10 mb hard disk space,,32.28,http://www.google.com/base/feeds/snippets/17479437813216357894
