,title_g,description_g,manufacturer_g,price_g,id_g
467,nicktoons winners cup racing for pc,nicktoons winner cup racing features fast paced racing action with and against popular characters from the top rated nickelodeon network. fans can pick their favorite character to race against or they can take on the persona of spongebob ...,,19.99,http://www.google.com/base/feeds/snippets/550226741008385683
468,digital video& audio prod book,launch your video & audio skills to new heights with the digital video & audio production. newly revised for version 7 by the original authors this book puts the stunning capabilities of vegas software right where they belong: in your production ...,,27.5,http://www.google.com/base/feeds/snippets/18394332776181186072
469,vegas + dvd sony,key features: three features in one professional dvds...,,899.99,http://www.google.com/base/feeds/snippets/11343247749866294908
470,encore software 14130 - wheel of fortune deluxe - win 98 me 2000 xp vista,encore software 14130 : spin the wheel and experience the enhanced game play and vivid graphics of the updated version of america's 1 game show! pick a consonant or buy a vowel to solve puzzles in three exciting new game modes; road trip group ...,,18.97,http://www.google.com/base/feeds/snippets/1503028931039652298
471,webroot software inc 54210 - webroot desktop firewall - firewall - pc,webroot software inc 54210 : a computer without a firewall is easy prey for hackers worms remote access trojans and other online threats. anti-spyware and virus protection are only a part of any security solution. a firewall is a critical ...,,25.97,http://www.google.com/base/feeds/snippets/904752907591542149
472,nova development corp humorous greeting card factory,now you can personalize and send the very best store-quality humorous greeting cards with art explosion® humorous greeting card factory®. never before has such an impressive collection of humorous greeting cards been available in one software pr,,28.3,http://www.google.com/base/feeds/snippets/18343959075631403504
473,emedia music corp emedia intermediate guitar method,top 100 cd-rom of the year. - pc magazine learn to play lead guitar and more! emedia intermediate guitar method is the easiest way to take your playing beyond basic chords and melodies. new techniques are demonstrated in over 175 lesson,,49.21,http://www.google.com/base/feeds/snippets/18180725296745787083
474,encore software 10567 - hoyle puzzle games 2007 - win 98 me 2000 xp,encore software 10567 : 30+ classic puzzle games brought to you by hoyle the 1 family entertainment brand. from sudoku to crosswords to mahjongg there is fun for the whole family. system requirements: windows 98se/me/2000 sp4/xp sp1* pentium iii ...,,18.97,http://www.google.com/base/feeds/snippets/381135748290856568
475,adobe cs3 design premium,system requirements powerpc g4 or g5 or intel core processor mac os x v10.4.8 java runtime environment 1.5 1gb ram 6.3gb free hard-disk space (additional space required during installation) 1024 x 768 display resolution with 16-bit video card ...,,1865.99,http://www.google.com/base/feeds/snippets/222400256379219119
476,microsoft office 2004 for students and teachers (mac),key features: for mac for student and teachers full-featured programs word processing spreadsheets create presentations...,,134.99,http://www.google.com/base/feeds/snippets/10092468528845066077
477,allume smith micro faxstf pro,system requirements powerpc g3 or intel equipped mac mac os x 10.3.9 or higher apple-supplied internal modem or a usb modem that supports mac os x and an analog telephone line,,44.99,http://www.google.com/base/feeds/snippets/18190371164810858934
478,adobe systems inc - 29180248 - adobe photoshop elements 5.0/premiere elements 3.0,adobe® photoshop® elements 5.0 plus adobe premiere® elements 3.0 software combines two powerful yet easy-to-use products to deliver the most complete photo and video editing solution. entertain friends with unique cinematic slide shows and,,139.51,http://www.google.com/base/feeds/snippets/18404168006486239466
479,h&r block taxcut premium federal and state software for windows - usb tax & finance software,taxcut premium federal and state software for windows - usb flash drive the taxcut premium federal and state software from h&r block is a tax preparation program that gives you the tools necessary to prepare and file your federal and state income ...,,29.95,http://www.google.com/base/feeds/snippets/11972925909028080525
480,versacheck(r) 2003 personal premier,print personal-size and custom checks in a snap! include your favorite clip art or scenery across your entire check! print checks to be filled out by hand or to use with quicken quickbooks and money. new features include express check designer for ...,,29.99,http://www.google.com/base/feeds/snippets/13936651598678930053
481,cms products dt-sftw - bounceback data transfer software - license & media - migration - 1 user(s) - license & media - standard - pc,cms products dt-sftw : save time upgrading your hard drive. cms bounceback data transfer software takes the effort out of migrating to a new hard drive by making a full and complete copy of your old hard drive including operating system ...,,8.53,http://www.google.com/base/feeds/snippets/12607980426776897005
482,adobe audition 2.0 audio production software music production software,audition 2.0 - multi-track audio production software for music radio and video - windows xp adobe audition 2.0 software is the all-in-one toolset for professional audio production allowing the user to record mix edit and master digital audio files. ...,,348.95,http://www.google.com/base/feeds/snippets/8918859484248831701
483,starry night galaxy explorer (pc & mac) (snge-5-c1u),starry night galaxy explorer (pc & mac) brand: imaginova mpn: snge-5-c1u variant name: starry night galaxy explorer (pc & mac),,9.59,http://www.google.com/base/feeds/snippets/13834985344480832776
484,graphic sim x-plane 8,system requirements: required: dvd-rom drive mac os x. or windows® 98 / me / 2000 / xp processor: 400 mhz 128mb ram. available hard drive: 6 gb. video card: 32 mb vram 3d supporting the opengl® api. recommended: usb joystick. processor: 1.0 ghz ...,,47.99,http://www.google.com/base/feeds/snippets/16445577344159065644
485,aspyr media inc enemy territory: quake wars,,,47.04,http://www.google.com/base/feeds/snippets/17686732625070159576
486,individual software prm-ss3 - professor teaches office super set (mass merchant box) (win 98 me 2000 xp),individual software prm-ss3 : professor teaches office super set is all new covering all the leading microsoft applications! 50+ tutorials on 10 cd-roms or 1 dvd-rom offer the most up to date instruction from beginning to advanced features of each ...,,27.97,http://www.google.com/base/feeds/snippets/4208369660309054934
487,leveractive llc giggles computer funtime for baby - shapes,this award-winning software for babies includes 14 charming keyboard tapping activities and over 50 great songs all in a baby-friendly software thats been carefully crafted through real-life research. for babies 6-to-24 months of age babies just ...,,15.82,http://www.google.com/base/feeds/snippets/17053187920066498620
488,whitney houston tad sisler yamaha whitney houston - smart pianosoft,this innovative software series enables your disklavier mark iii piano to perform with the world's most popular cds! using yamaha's pianosmart technology this companion diskette will magically empower your disklavier mark iii to accompany the ...,,14.86,http://www.google.com/base/feeds/snippets/17993980055732323123
489,onone software essentials for adobe photoshop elements version 2 - full,,,59.33,http://www.google.com/base/feeds/snippets/17615743519264436737
490,david kreisberg yamaha the fantasticks - original broadway cast - smart pianosoft,this innovative software series enables your disklavier mark iii piano to perform with the world's most popular cds! using yamaha's pianosmart technology this companion diskette will magically empower your disklavier mark iii to accompany the ...,,18.5,http://www.google.com/base/feeds/snippets/16741046705400224203
491,intuit quicken mac 2007 software finance software,quicken mac 2007 software the quicken mac 2007 software from intuit is a suite of powerful tools that are designed to help you manage your personal finances. the software allows you to manage money track accounts optimize investments and organize ...,,69.95,http://www.google.com/base/feeds/snippets/3192985906364439341
492,quickbooks(r),professional and impressive!imprinted with your business name and address!guaranteed compatible with your quickbooks(r) and quickbooks for windows(r) software.neat and clean. no carbon to touch. runs easily and smoothly through your printer without ...,,103.99,http://www.google.com/base/feeds/snippets/4668015493763020112
493,encore inc family tree maker v 16 essentials,family tree maker® essentials edition v16 is the 1 bestselling resource to create your family tree. easily compile organize and share your unique keepsake. bonus 3-month subscription to ancestry.com. system requirements: windows® 98s,,25.75,http://www.google.com/base/feeds/snippets/17896835956549874370
494,csdc macdrive 7 for windows - mediafour corp.,share files between mac disks and windows. macdrive turns windows pcs and intel-based macs running boot camp into cross-platform file sharing powerhouses giving them the ability to open edit and save files from mac disks. with macdrive ther,,39.61,http://www.google.com/base/feeds/snippets/17936351408567096042
495,punch software 85100 - punch!master landscape pro v10 and home design,punch software 85100 : the new! master landscape pro and home design v10 includes a more robust interface for editing specifying precise dimensions displaying options and more. new enhancements for pool design gps sun angles and content updater ...,,59.97,http://www.google.com/base/feeds/snippets/7997047825469627962
496,encore software 12491 - encore kissing canines - screen saver,encore software 12491 : finally a screen saver for the dog lover in all of us. kissing canines brings the entertainment and joy of dogs to your computer while bringing a smile to your face again and again. /pp in this video screen saver real dogs ...,,17.97,http://www.google.com/base/feeds/snippets/4395553239306869895
497,apple garageband jam pack: rhythm section,system requirements requires garageband (installed with ilife '04 or '05)* logic express 7 or logic pro 7. soundtrack supports loops only in jam packs. macintosh computer with g3 600mhz processor or higher to use apple loops (g4 or g5 required for ...,,95.99,http://www.google.com/base/feeds/snippets/11641601394104549163
498,freeverse software wingnuts 2,baron von schtopwatch is back in this all new adventure! using a cutting edge opengl engine a new arsenal including beam weapons spawning ground installations harsh robot ai and endless maps wingnuts 2 raises the bar for mac arcade games!,,26.14,http://www.google.com/base/feeds/snippets/17261970023689791051
499,microsoft office visio standard 2007 upgrade (pc),key features: visualize complex info pro-quality designs convenient templates communicate using diagrams works w/ other office apps highly customizable ...,,129.95,http://www.google.com/base/feeds/snippets/13673799320876526338
500,kaspersky anti-virus 6.0 (pc),key features: complete protection easy to install instant updates...,,59.99,http://www.google.com/base/feeds/snippets/10497976503252074561
501,viva media llc learn to play chess with fritz & chesster 2,jump into chess action move by move to rescue chesster from deep within king black's castle. join fritz and bianca in a thrilling chess adventure where each challenge will help you sharpen your skills and prepare for the ultimate showdown. <l,,26.14,http://www.google.com/base/feeds/snippets/17407485579094223073
502,dramatica pro 4 for pc,for pc media format cd dramatica pro acts as your creative-writing partner. helps you solve the plots & character problems that prevent good stories from being sold assists you from the initial idea all the way through to the completed narrative ...,,249.99,http://www.google.com/base/feeds/snippets/18419564278412211145
503,viva media llc riding academy: jump & ride,with this great software players will be able to experience realistic horse back racing. there are 12 action packed steeplechase courses and 6 different fredily horse to chose from. system requirements: win: 400mhz pemtium pc ii 128 mb ram,,17.55,http://www.google.com/base/feeds/snippets/17982318849719467269
504,feral interactive the movies,minimum system requirements (macintosh) mac os 10.3 'panther' powerpc g4 1 ghz 256 mb ram hardware accelerated 3d graphics card with 32 mb vram dvd drive 3 gb free hard disk space. mouse and keyboard recommended system requirements (macintosh) mac ...,,47.99,http://www.google.com/base/feeds/snippets/779838933309218814
505,merriam-webster english dictionary (win 2000 xp/mac 10.3.8 or later),merriam-webster's dictionary is a handy reliable and authoritative dictionary of the words most frequently used in english. includes the merriam-webster thesaurus.features:70000 clear concise definitionsthesaurus features 157000 entriesmultiple ...,,9.99,http://www.google.com/base/feeds/snippets/13727078323480476968
506,apple final cut studio 2 production suite for mac av production software,final cut studio 2 production software suite for mac - final cut pro 6 motion 3 soundtrack pro 2 color compressor 3 dvd studio pro 4 special offer the final cut studio 2 production software suite for mac from apple is the premiere professional suite ...,,1298.95,http://www.google.com/base/feeds/snippets/1872945109493928217
507,intuit quickbooks pro 2007 for mac,recommended system configuration computer: macintosh with g4 g5 or intel core processor operating system: mac 0s x v10.4.7 memory: 256 mb installed ram hard disk space: at least 100 mb of free disk space monitor: color monitor with 1280x854 minimum ...,,185.99,http://www.google.com/base/feeds/snippets/16714036815187031033
508,instant immersion italian 2.0,topics entertainment instant immersion italian 2.0 this 5 cd-rom suite immerses you in the learning process with cultural videos entertaining games and interactive lessons with native speakers windows/mac,topics entertainment,20.99,http://www.google.com/base/feeds/snippets/10066664236286478958
509,aquarium 3-in-one limited edition (win 95 98 me 2000 xp/mac 10.1 or higher),an amazing collection so vibrant and realistic you won t believe your eyes! experience the 1 selling screensaver of all time marine aquarium plus goldfish aquarium and sharks. gorgeous details have gone into creating the high-resolution 3d fish ...,,19.95,http://www.google.com/base/feeds/snippets/13804410937823415271
510,enfocus software pp7.0-u1-001 - pitstop pro 7.0 upgr - 5.x or below,enfocus software pp7.0-u1-001 : enfocus software pitstop pro 7.0 upgr - 5.x or below - pp7.0-u1-001,,257.97,http://www.google.com/base/feeds/snippets/10542539041826323398
511,print perfect business cards dvd (pc) cosmi,key features: over 50000 images customize your cards variety of templates 600 fonts ...,,29.99,http://www.google.com/base/feeds/snippets/12965745281480952652
512,apple ilife '06 family pack,system requirements macintosh computer with a powerpc g4 g5 or intel core duo processor; 733mhz or faster required for idvd 256mb of ram; 512mb recommended mac os x v10.3.9 or mac os x v10.4.3 or later; mac os x v10.4.4 recommended itunes 6.0.2 and ...,,99.99,http://www.google.com/base/feeds/snippets/10939909441298262260
513,nero nero 7 ultra edition enhanced cd/dvd burning software for windows authoring software,nero 7 ultra edition enhanced cd/dvd burning software for windows the nero 7 ultra edition enhanced cd/dvd burning software for windows from nero is a powerful software suite for windows that allows you to get the most out of your dvd hd dvd or ...,,79.99,http://www.google.com/base/feeds/snippets/10856062098610973379
514,f-secure internet security 2007 - 3 pcs (global marketing partners),f-secure internet security 2007 - 3 pcs brand: global marketing partners mpn: global marketing partners variant name: f-secure internet security 2007 - 3 pcs,,63.35,http://www.google.com/base/feeds/snippets/9858798962478264497
515,encore software 10272 - marine aquarium + sharks - win 98 me 2000 xp,encore software 10272 : marine aquarium is the only screen saver used by over a quarter of a million users offering 26 fish and an unprecedented bonus of 11 sharks free! system requirements: windows 98se/me/2000 sp4/xp sp1* pentium class cpu (120mhz ...,,7.69,http://www.google.com/base/feeds/snippets/4747185109584668947
516,visual modeling with rational software architect and uml,terry's style is always direct approachable and pragmatic. abstraction is hard and visualizing abstractions is as well but here she'll guide you in doing both using rational software architect. --from the foreword by grady booch ibm fellow ...,,42.56,http://www.google.com/base/feeds/snippets/11418869639535347587
517,apple mac os x 10.4.6 tiger family pack,what's included with tiger in the box installation dvd xcode 2 developer tools installation and setup guide welcome to mac os x tiger user guide applications address book 4 automator calculator 4 chess dashboard dictionary dvd player 4.5 font book 2 ...,,185.99,http://www.google.com/base/feeds/snippets/17214545032473425136
518,microsoft microsoft office 2004 software suite - mac - education apple & mac software,microsoft office 2004 student and teacher edition software suite - mac - education special offer microsoft office 2004 student and teacher edition for mac offers an expansive set of tools and integrated applications for creating managing and ...,,148.95,http://www.google.com/base/feeds/snippets/18372325427432567642
519,boost xp,boostxp by allume - maximum pc performance! now anyone can keep their computer in peak condition! boost performance protect your pc clean-up clutter customize your pc. key benefits boost performance the most thorough way to tune-up your pc. improve ...,,15.9,http://www.google.com/base/feeds/snippets/7039940734695244235
520,act!(r) 2006 premium for workgroups,act! 2006 premium for workgroups is a contact and customer manager that helps corporate workgroups and sales teams make contact build relationships and get results. act! 2006 provides advanced workgroup functionality for administration security ...,,399.99,http://www.google.com/base/feeds/snippets/16880957175645692718
521,weekly reader mastering elementary & middle school math (pc/mac) fogware,key features: dynamic audio and video tracks student progress for all levels grades 1-8 ...,,19.99,http://www.google.com/base/feeds/snippets/9522193715675586199
522,printmaster platinum 16,if you?ve got a passion for creative self-expression you?ll find endless inspiration in this sophisticated easy-to-use program. enjoy all of the great features you expect from printmaster plus brilliant new upgrades that make personal creativity ...,,19.95,http://www.google.com/base/feeds/snippets/12794387524239668290
523,sos aggregation company dance praise - digital praise,turn your computer into a lively dance arcade for hours of family fun with music worth listening to! show your kill with the latest dance game and keep movin' to the hottest christian hits featuring : zoegirl tobymac steven curtis chapman and more !,,39.37,http://www.google.com/base/feeds/snippets/16694806128312036500
524,autodesk 34006-010008-160 raster design 2006 essentials,raster design 2006 essentials,autodesk,52.99,http://www.google.com/base/feeds/snippets/18396354299258717606
525,instant immers spanish dlux 2,model- topcd-80692wi vendor- topics entertainment features- instant immersion spanish deluxe v2.0 your first-class journey to a new language is ready to commence with instant immersion spanish deluxe v2.0 the multimedia learning collection on cd-rom ...,,36.11,http://www.google.com/base/feeds/snippets/10623432141570708774
526,sonicwall gms 1000n-incremental lic upg,today enterprises and service providers face increasing security challenges in their distributed networks from security and virus attacks to enforcing security policies. as a distributed network grows and branches into multiple subnetworks linked ...,,62920.89,http://www.google.com/base/feeds/snippets/3409784122469217433
527,encore software 10634 - 3d home architect home v.8 by,encore software 10634 : 3d home architect home v.8 by encore software - 10634,,33.97,http://www.google.com/base/feeds/snippets/4703701453618359906
528,adobe audition 2.0 audio production software - educational discount audio software for video,audition 2.0 - multi-track audio production software for music radio and video for windows xp - educational discount adobe audition 2.0 software is the all-in-one toolset for professional audio production allowing the user to record mix edit and ...,,148.95,http://www.google.com/base/feeds/snippets/890958699191814692
529,yamaha james taylor james taylor - greatest hits - smart pianosoft,this innovative software series enables your disklavier mark iii piano to perform with the world's most popular cds! using yamaha's pianosmart technology this companion diskette will magically empower your disklavier mark iii to accompany the ...,,14.86,http://www.google.com/base/feeds/snippets/18057453863734492529
530,adobe flash cs3 professional (mac),key features: creative flexibility software integration maximize productivity extend your reach...,,699.0,http://www.google.com/base/feeds/snippets/13125236767288549966
531,adobe illustrator cs3 for mac,system requirements powerpc g4 or g5 or intel core processor mac os x v10.4.8 512mb ram (1gb recommended) 2.5gb free hard-disk space (additional space required during installation) 1024 x 768 display resolution with 16-bit video card dvd-rom drive ...,,619.99,http://www.google.com/base/feeds/snippets/2927219174769865115
532,usoa289 iris readiris pro - ( v. 11 ) - complete package - 1 user - win,iris group usoa289 : usually ships in 24 hours : in stock : readiris pro 11 the most advanced ocr software for mac quickly and easily transforms your paper documents into electronic files you can edit into your favorite application.,,110.07,http://www.google.com/base/feeds/snippets/13086087912501926764
533,allume anime studio 5,system requirements mac os x v10.3.9 or later (os x v10.4 or later recommended) 500mhz or faster power pc g4 g5 or intel core processor (intel processor recommended) 256mb ram 50mb free hard-disk space 1024 x 768 display resolution with 16-bit ...,,44.99,http://www.google.com/base/feeds/snippets/2854532146016566771
534,knowledge adventure inc. jumpstart world 2nd grade - mini box,welcome to jumpstart world 2nd grade a revolutionary 3d world of learning that actually progresses in response to a child?s own learning pace. it?s super-personalized wildly imaginative and really fun but don?t let that fool you - it also teaches ...,,16.93,http://www.google.com/base/feeds/snippets/17544872940647061920
535,valusoft tune transfer for ipod,system requirements: (works with ipod and ipod shuffle) macintosh requirements: ? system os x (10.1.5) or higher ? g3 400 mhz processor ? 128 mb ram ? 100 mb free hd space ? cd-rom drive ? working usb 2.0 or firewire connection to ipod pc ...,,21.99,http://www.google.com/base/feeds/snippets/17512159947329144136
537,adobe photoshop cs3 extended for mac,system requirements powerpc g4 or g5 or intel core processor mac os x v10.4.8 512mb ram 64mb vram 2gb free hard-disk space (additional space required during installation) 1024 x 768 display resolution with 16-bit video card dvd-rom drive internet or ...,,935.99,http://www.google.com/base/feeds/snippets/7928058720709111960
538,apple software m8789z/a webobjects 5.2,the easiest way to build powerful web services. webobjects makes it easy to quickly develop and deploy your java server applications. now with version 5.2 you can offer these applications as standards-based web services as well.a powerful rapid ...,apple software,648.99,http://www.google.com/base/feeds/snippets/4776201646741876078
539,microsoft 392-02322 ae frontpage 2003,microsoft frontpage academicmodel- ms-cd34597wiaevendor- microsoft corporation** academic authorized version **features- microsoft frontpage 2003 frontpage 2003 provides the features flexibility and functionalityto help you build better web sites. ...,,87.99,http://www.google.com/base/feeds/snippets/18413075895200367717
540,corel intervideo windvd 8 gold software for windows authoring software,windvd 8 gold software for windows the windvd 8 gold software for windows from corel intervideo is a dvd video playback application for windows. the software leverages computer technologies such as dual-core processors and nvidia pure video graphics ...,,49.95,http://www.google.com/base/feeds/snippets/9592753698712041843
541,hal leonard allegro 2007 5-user labpack,,,272.94,http://www.google.com/base/feeds/snippets/18111145490199629534
542,roxio inc stopzilla 4.0,cnet editors? choice award winner! stopzilla?s true real-time® protection is unbeatable. it detects and destroys spyware and pop-ups and blocks online threats including phishing attacks. stopzilla?s superior technology delivers daily updates,,26.14,http://www.google.com/base/feeds/snippets/17911312393691300802
543,instant home design 3.0,from windows to walls; railings to roofs now you can design the home of your dreams with a few clicks of the mouse and the powerful user-friendly tech tools exclusive to instant home design 3.0 on cd-rom. developed especially for the at-home user ...,,15.9,http://www.google.com/base/feeds/snippets/4783370532123880956
